display_order,panel_role,step_label,figure_title,figure_body,source_scope,downstream_role,claim_boundary
1,Input hypothesis,contract,1. Specified source–receiver hypothesis,"Lineage root; source mask; receiver mask; boundary exclusions",Specified before scoring,Defines the tested source–receiver hypothesis,"Hypothesis definition only; not evidence of geographic origin, ethnic identity, population continuity, or migration route."
2,Observed public-tree layer,public_y_tree,2. Public Y-tree data,"Branch-country labels; deepest public branch; country-level visibility",Curated public-tree observation layer,Provides the scoreable branch-country observations,"Public-tree observation layer only; not a population-representative sample or an origin assignment."
3,Primary geometry,geometry,3. Source–receiver geometry,"A_s = n_source / n_receiver; D = ln(q2_receiver / q2_source); q2 = 1 / sum(p_i^2)",Computed from the specified source and receiver masks,Tests source adequacy and receiver/source branch-diversity geometry,"Geometry evaluates compatibility with the specified hypothesis; it does not identify exact origin."
4,Reliability layer,reliability,4. Reliability layer,"Branch-unit sensitivity; country perturbation; rarefaction and minimum-data checks; no-call rules",Applied after primary geometry,Separates stable calls from fragile or underpowered states,"Reliability checks bound evidentiary use; they do not convert public visibility into population frequency."
5,Decision grammar,decision_states,5. Decision states,"Compatible state; stable model rejection; fragile/support-only state; no-call",Decision-state assignment,"Controls whether a row is load-bearing, supporting, diagnostic, or boundary only","State assignment is bounded to the tested hypothesis and should not be read as ancestry assignment."
6,Claim discipline,claim_tiering,6. Claim tiering,"Load-bearing; supporting; diagnostic negative; boundary/no-call; unsupported",Manuscript claim hierarchy,"Prevents overinterpretation of compatible states, rejections, support-only signals, and no-calls","Claim tiering blocks inference about exact geographic origin, ethnic identity, population continuity, migration route, and ancient-DNA confirmation."
