"layer_order","added_layer","effect_on_claim_hierarchy","primary_repository_sources","claim_boundary"
"01","A_s and D only","The deepest-layer directional rule identifies 1,163/2,466 atlas rows as compatible before reliability classification; only 118 remain robust compatible after branch-unit, perturbation, scoreability and boundary rules.","tables/14_yfull_reliability_atlas_background.csv; tables/04_source_layers_and_headline_coordinates.csv; tables/26_benchmark_audit_card_matrix.csv","Ablation summary only; not evidence of geographic origin, ethnic identity, population continuity, migration route, ancient-DNA confirmation, or population frequency."
"02","Minimum terminal and country-count gates","Prevents underpowered rows from being promoted when source or receiver visibility is insufficient.","tables/14_yfull_reliability_atlas_background.csv; tables/26_benchmark_audit_card_matrix.csv","Ablation summary only; not evidence of geographic origin, ethnic identity, population continuity, migration route, ancient-DNA confirmation, or population frequency."
"03","Branch-unit sensitivity","Demotes deepest-layer compatible signals when compatibility does not survive coarser or alternative branch-unit layers; this is why O-M119 and O-M122 remain support-only diagnostics.","tables/11_branch_unit_reliability_pass_matrix.csv; tables/12_branch_unit_reliability_pass_pivot_summary.csv","Ablation summary only; not evidence of geographic origin, ethnic identity, population continuity, migration route, ancient-DNA confirmation, or population frequency."
"04","Rarefaction and country perturbation","Separates power and visibility limits from stable source-receiver decisions under altered sampling or country-mask conditions.","tables/05_matched_r1a_comparator_calibration_summary.csv; tables/27_figure_4_sensitivity_design_denominator_matrix.csv","Ablation summary only; not evidence of geographic origin, ethnic identity, population continuity, migration route, ancient-DNA confirmation, or population frequency."
"05","Boundary and no-call rules","Retains H-M82 and E-M2 as boundary/no-call cases rather than forcing a primary decision when diaspora structure, source visibility or source-receiver independence is inadequate.","tables/main_table_1_source_receiver_audit_cards.csv; tables/02_lineage_role_tiers.csv","Ablation summary only; not evidence of geographic origin, ethnic identity, population continuity, migration route, ancient-DNA confirmation, or population frequency."
"06","Adversarial source-receiver sensitivity","Finds ten weak directional PH908 states but zero matched-envelope states, keeping weak compatibility as transparency rather than load-bearing support.","tables/06_adversarial_sensitivity_summary.csv; tables/27_figure_4_sensitivity_design_denominator_matrix.csv","Ablation summary only; not evidence of geographic origin, ethnic identity, population continuity, migration route, ancient-DNA confirmation, or population frequency."
"07","Synthetic source-visibility degradation","Shows that compatible R1a comparators degrade to fragile or no-call states under source-country loss rather than becoming PH908-like support.","tables/28_figure_4_synthetic_source_visibility_degradation_trace.csv","Ablation summary only; not evidence of geographic origin, ethnic identity, population continuity, migration route, ancient-DNA confirmation, or population frequency."
"08","Visibility-bias reversal","Quantifies the hidden source-side burden needed to move PH908 into compatibility while treating the calculation as a sensitivity bound rather than a population-size estimate.","tables/30_figure_4_primary_visibility_bias_reversal_summary.csv","Ablation summary only; not evidence of geographic origin, ethnic identity, population continuity, migration route, ancient-DNA confirmation, or population frequency."
